[
  {
    "id": "017ba60656",
    "schema_version": "2020-12.v1",
    "created_at": "2026-01-08T10:00:00Z",
    "repo": "mcg-checkout-service",
    "pr": "PR-0207",
    "story": "CHK-1421",
    "author": "a.rivera",
    "message": "CHK-1421: implement initial guest checkout implementation",
    "committed_at": "2026-01-08T10:00:00Z",
    "additions": 104,
    "deletions": 38,
    "files_changed": 1
  },
  {
    "id": "a1eba69f9e",
    "schema_version": "2020-12.v1",
    "created_at": "2026-01-08T11:00:00Z",
    "repo": "mcg-checkout-service",
    "pr": "PR-0207",
    "story": "CHK-1421",
    "author": "a.rivera",
    "message": "CHK-1421: add tests for initial guest checkout implementation",
    "committed_at": "2026-01-08T13:00:00Z",
    "additions": 112,
    "deletions": 36,
    "files_changed": 6
  },
  {
    "id": "b71de4385f",
    "schema_version": "2020-12.v1",
    "created_at": "2026-01-08T12:00:00Z",
    "repo": "mcg-checkout-service",
    "pr": "PR-0207",
    "story": "CHK-1421",
    "author": "a.rivera",
    "message": "CHK-1421: refactor initial guest checkout implementation",
    "committed_at": "2026-01-08T16:00:00Z",
    "additions": 106,
    "deletions": 33,
    "files_changed": 6
  },
  {
    "id": "64121b4c79",
    "schema_version": "2020-12.v1",
    "created_at": "2026-01-08T13:00:00Z",
    "repo": "mcg-checkout-service",
    "pr": "PR-0207",
    "story": "CHK-1421",
    "author": "a.rivera",
    "message": "CHK-1421: fix edge case in initial guest checkout implementation",
    "committed_at": "2026-01-08T19:00:00Z",
    "additions": 62,
    "deletions": 32,
    "files_changed": 6
  },
  {
    "id": "edfbc6f30c",
    "schema_version": "2020-12.v1",
    "created_at": "2026-01-08T14:00:00Z",
    "repo": "mcg-checkout-service",
    "pr": "PR-0207",
    "story": "CHK-1421",
    "author": "a.rivera",
    "message": "CHK-1421: wire up initial guest checkout implementation",
    "committed_at": "2026-01-09T10:00:00Z",
    "additions": 62,
    "deletions": 13,
    "files_changed": 3
  },
  {
    "id": "e348616920",
    "schema_version": "2020-12.v1",
    "created_at": "2026-01-13T09:00:00Z",
    "repo": "mcg-checkout-service",
    "pr": "PR-0312",
    "story": "CHK-1421",
    "author": "a.rivera",
    "message": "CHK-1421: implement guard against loyalty account creation for guests",
    "committed_at": "2026-01-13T09:00:00Z",
    "additions": 76,
    "deletions": 38,
    "files_changed": 1
  },
  {
    "id": "a71be580ef",
    "schema_version": "2020-12.v1",
    "created_at": "2026-01-13T10:00:00Z",
    "repo": "mcg-checkout-service",
    "pr": "PR-0312",
    "story": "CHK-1421",
    "author": "a.rivera",
    "message": "CHK-1421: add tests for guard against loyalty account creation for guests",
    "committed_at": "2026-01-13T12:00:00Z",
    "additions": 28,
    "deletions": 25,
    "files_changed": 4
  },
  {
    "id": "622d1c64fe",
    "schema_version": "2020-12.v1",
    "created_at": "2026-01-13T11:00:00Z",
    "repo": "mcg-checkout-service",
    "pr": "PR-0312",
    "story": "CHK-1421",
    "author": "a.rivera",
    "message": "CHK-1421: refactor guard against loyalty account creation for guests",
    "committed_at": "2026-01-13T15:00:00Z",
    "additions": 3,
    "deletions": 40,
    "files_changed": 3
  },
  {
    "id": "b29751bf56",
    "schema_version": "2020-12.v1",
    "created_at": "2026-01-13T12:00:00Z",
    "repo": "mcg-checkout-service",
    "pr": "PR-0312",
    "story": "CHK-1421",
    "author": "a.rivera",
    "message": "CHK-1421: fix edge case in guard against loyalty account creation for guests",
    "committed_at": "2026-01-13T18:00:00Z",
    "additions": 3,
    "deletions": 12,
    "files_changed": 5
  },
  {
    "id": "450f372743",
    "schema_version": "2020-12.v1",
    "created_at": "2026-01-13T13:00:00Z",
    "repo": "mcg-checkout-service",
    "pr": "PR-0312",
    "story": "CHK-1421",
    "author": "a.rivera",
    "message": "CHK-1421: wire up guard against loyalty account creation for guests",
    "committed_at": "2026-01-14T09:00:00Z",
    "additions": 74,
    "deletions": 39,
    "files_changed": 4
  },
  {
    "id": "a8a8ed180b",
    "schema_version": "2020-12.v1",
    "created_at": "2026-01-13T14:00:00Z",
    "repo": "mcg-checkout-service",
    "pr": "PR-0312",
    "story": "CHK-1421",
    "author": "a.rivera",
    "message": "CHK-1421: handle error path in guard against loyalty account creation for guests",
    "committed_at": "2026-01-14T12:00:00Z",
    "additions": 104,
    "deletions": 26,
    "files_changed": 3
  },
  {
    "id": "90602efcc3",
    "schema_version": "2020-12.v1",
    "created_at": "2026-03-06T10:00:00Z",
    "repo": "mcg-payments-service",
    "pr": "PR-0503",
    "story": "PAY-980",
    "author": "l.schmidt",
    "message": "PAY-980: implement 3DS2 challenge flow",
    "committed_at": "2026-03-06T10:00:00Z",
    "additions": 20,
    "deletions": 35,
    "files_changed": 6
  },
  {
    "id": "799744fd92",
    "schema_version": "2020-12.v1",
    "created_at": "2026-03-06T11:00:00Z",
    "repo": "mcg-payments-service",
    "pr": "PR-0503",
    "story": "PAY-980",
    "author": "l.schmidt",
    "message": "PAY-980: add tests for 3DS2 challenge flow",
    "committed_at": "2026-03-06T13:00:00Z",
    "additions": 23,
    "deletions": 1,
    "files_changed": 5
  },
  {
    "id": "0cb8678213",
    "schema_version": "2020-12.v1",
    "created_at": "2026-03-06T12:00:00Z",
    "repo": "mcg-payments-service",
    "pr": "PR-0503",
    "story": "PAY-980",
    "author": "l.schmidt",
    "message": "PAY-980: refactor 3DS2 challenge flow",
    "committed_at": "2026-03-06T16:00:00Z",
    "additions": 42,
    "deletions": 17,
    "files_changed": 1
  },
  {
    "id": "990bfba276",
    "schema_version": "2020-12.v1",
    "created_at": "2026-03-06T13:00:00Z",
    "repo": "mcg-payments-service",
    "pr": "PR-0503",
    "story": "PAY-980",
    "author": "l.schmidt",
    "message": "PAY-980: fix edge case in 3DS2 challenge flow",
    "committed_at": "2026-03-06T19:00:00Z",
    "additions": 38,
    "deletions": 31,
    "files_changed": 6
  },
  {
    "id": "add3c8817a",
    "schema_version": "2020-12.v1",
    "created_at": "2026-03-06T14:00:00Z",
    "repo": "mcg-payments-service",
    "pr": "PR-0503",
    "story": "PAY-980",
    "author": "l.schmidt",
    "message": "PAY-980: wire up 3DS2 challenge flow",
    "committed_at": "2026-03-07T10:00:00Z",
    "additions": 103,
    "deletions": 6,
    "files_changed": 2
  },
  {
    "id": "cbb5c48e04",
    "schema_version": "2020-12.v1",
    "created_at": "2026-03-06T15:00:00Z",
    "repo": "mcg-payments-service",
    "pr": "PR-0503",
    "story": "PAY-980",
    "author": "l.schmidt",
    "message": "PAY-980: handle error path in 3DS2 challenge flow",
    "committed_at": "2026-03-07T13:00:00Z",
    "additions": 78,
    "deletions": 33,
    "files_changed": 4
  },
  {
    "id": "dae6752b33",
    "schema_version": "2020-12.v1",
    "created_at": "2026-03-06T16:00:00Z",
    "repo": "mcg-payments-service",
    "pr": "PR-0503",
    "story": "PAY-980",
    "author": "l.schmidt",
    "message": "PAY-980: add metrics to 3DS2 challenge flow",
    "committed_at": "2026-03-07T16:00:00Z",
    "additions": 85,
    "deletions": 14,
    "files_changed": 2
  },
  {
    "id": "1cf402e6f5",
    "schema_version": "2020-12.v1",
    "created_at": "2026-03-06T17:00:00Z",
    "repo": "mcg-payments-service",
    "pr": "PR-0503",
    "story": "PAY-980",
    "author": "l.schmidt",
    "message": "PAY-980: document 3DS2 challenge flow",
    "committed_at": "2026-03-07T19:00:00Z",
    "additions": 97,
    "deletions": 29,
    "files_changed": 3
  },
  {
    "id": "b31f14cfb5",
    "schema_version": "2020-12.v1",
    "created_at": "2026-03-06T18:00:00Z",
    "repo": "mcg-payments-service",
    "pr": "PR-0503",
    "story": "PAY-980",
    "author": "l.schmidt",
    "message": "PAY-980: address review on 3DS2 challenge flow",
    "committed_at": "2026-03-08T10:00:00Z",
    "additions": 94,
    "deletions": 37,
    "files_changed": 3
  },
  {
    "id": "83ec4af58d",
    "schema_version": "2020-12.v1",
    "created_at": "2026-04-01T19:00:00Z",
    "repo": "mcg-catalog-service",
    "pr": "PR-0200",
    "story": "CAT-949",
    "author": "n.almeida",
    "message": "CAT-949: implement Category taxonomy versioning",
    "committed_at": "2026-04-01T19:00:00Z",
    "additions": 58,
    "deletions": 27,
    "files_changed": 4
  },
  {
    "id": "98ca61339f",
    "schema_version": "2020-12.v1",
    "created_at": "2026-04-01T20:00:00Z",
    "repo": "mcg-catalog-service",
    "pr": "PR-0200",
    "story": "CAT-949",
    "author": "n.almeida",
    "message": "CAT-949: add tests for Category taxonomy versioning",
    "committed_at": "2026-04-01T22:00:00Z",
    "additions": 4,
    "deletions": 5,
    "files_changed": 6
  },
  {
    "id": "21cd81638c",
    "schema_version": "2020-12.v1",
    "created_at": "2026-04-01T21:00:00Z",
    "repo": "mcg-catalog-service",
    "pr": "PR-0200",
    "story": "CAT-949",
    "author": "n.almeida",
    "message": "CAT-949: refactor Category taxonomy versioning",
    "committed_at": "2026-04-02T01:00:00Z",
    "additions": 62,
    "deletions": 32,
    "files_changed": 3
  },
  {
    "id": "5392eee3cf",
    "schema_version": "2020-12.v1",
    "created_at": "2026-04-01T22:00:00Z",
    "repo": "mcg-catalog-service",
    "pr": "PR-0200",
    "story": "CAT-949",
    "author": "n.almeida",
    "message": "CAT-949: fix edge case in Category taxonomy versioning",
    "committed_at": "2026-04-02T04:00:00Z",
    "additions": 76,
    "deletions": 7,
    "files_changed": 3
  },
  {
    "id": "e2f2a8847c",
    "schema_version": "2020-12.v1",
    "created_at": "2026-04-21T19:00:00Z",
    "repo": "mcg-customer-portal",
    "pr": "PR-0449",
    "story": "POR-643",
    "author": "b.kowalski",
    "message": "POR-643: implement Download invoice as pdf",
    "committed_at": "2026-04-21T19:00:00Z",
    "additions": 83,
    "deletions": 1,